{
  "$schema": "https://json-schema.org/draft/2020-12/schema",
  "$id": "urn:ukai:schema:ledger-bundle-verification:1",
  "type": "object",
  "properties": {
    "schema": {
      "const": "ukai.ledger.bundle-verification/1"
    },
    "run_id": {
      "type": "string",
      "pattern": "^run_[0-9a-f]{32}$"
    },
    "snapshot": {
      "type": "object",
      "properties": {
        "head_seq": {
          "type": "integer",
          "minimum": 0
        },
        "head_digest": {
          "anyOf": [
            {
              "type": "string",
              "pattern": "^sha256:[0-9a-f]{64}$"
            },
            {
              "type": "null"
            }
          ]
        }
      },
      "required": [
        "head_seq",
        "head_digest"
      ],
      "additionalProperties": false
    },
    "state": {
      "enum": [
        "prepared",
        "admitted",
        "denied",
        "settled",
        "outcome_unknown"
      ],
      "description": "Settled means a durably recorded terminal result after admission, including a proved exec_error; it does not imply success. Denied is a refusal before ledger admission."
    },
    "child_protection": {
      "enum": [
        "enforced",
        "unprotected"
      ]
    },
    "coverage": {
      "type": "object"
    },
    "projection_rule": {
      "enum": [
        1,
        2
      ],
      "description": "The run projection rule the embedded run matched (ledger-v1 §8.4). 2 is current. 1 is accepted only for an outcome_unknown run whose outcome alone differs, as bundles exported before 2026-10-14 embed it."
    },
    "local_consistency": {
      "const": true
    },
    "authenticity": {
      "const": "unsigned"
    },
    "external_custody": {
      "const": false
    },
    "capture_digest_basis": {
      "const": "bundle_time"
    },
    "captures": {
      "type": "array",
      "maxItems": 3,
      "uniqueItems": true,
      "items": {
        "enum": [
          "stdout",
          "stderr",
          "argv"
        ]
      }
    },
    "manifest_digest": {
      "type": "string",
      "pattern": "^sha256:[0-9a-f]{64}$"
    }
  },
  "required": [
    "schema",
    "run_id",
    "snapshot",
    "state",
    "child_protection",
    "coverage",
    "local_consistency",
    "authenticity",
    "external_custody",
    "capture_digest_basis",
    "captures",
    "manifest_digest"
  ],
  "additionalProperties": false
}
