{
  "authenticity": "unsigned",
  "capture_digest_basis": "bundle_time",
  "captures": [],
  "child_protection": "unprotected",
  "coverage": {
    "status": "unobserved"
  },
  "external_custody": false,
  "local_consistency": true,
  "manifest_digest": "sha256:056d765d039377a106999d394d75576c5cfa59e2ac80f4eea2ad16101a99ad6d",
  "projection_rule": 2,
  "run_id": "run_2d907e8d3d464749940ba1d279460857",
  "schema": "ukai.ledger.bundle-verification/1",
  "snapshot": {
    "head_digest": "sha256:e2b676582024f6f9ef063e497c4751deb23427a923ebd3748b7aabf5e362942f",
    "head_seq": 1
  },
  "state": "prepared"
}
